{
  "$schema": "../../schema/profile.schema.json",
  "schema_version": 1,
  "name": "classic",
  "description": "Classic profile (plan section 1): the eleven classic stages, from the fractal seed fields to the final verification (ADR 0021).",
  "stages": ["c01_allocate", "c02_seed", "c03_fit", "c04_vegetation", "c05_shape", "c06_rivers", "c07_smooth", "c08_climate", "c09_biomes", "c10_subsurface", "c11_verify"]
}
