{
  "$schema": "../../../schema/profile.schema.json",
  "schema_version": 1,
  "name": "classic_geology",
  "description": "A prefix of data/profiles/classic.json for tests: the classic stages up to the subsurface (c01-c10).",
  "stages": ["c01_allocate", "c02_seed", "c03_fit", "c04_vegetation", "c05_shape", "c06_rivers", "c07_smooth", "c08_climate", "c09_biomes", "c10_subsurface"]
}
