{
  "$schema": "../../../schema/profile.schema.json",
  "schema_version": 1,
  "name": "classic_rivers",
  "description": "The classic stages implemented so far (A12-A17), with rivers, until data/profiles/classic.json arrives with A23.",
  "stages": ["c01_allocate", "c02_seed", "c03_fit", "c05_shape", "c06_rivers", "c07_smooth"]
}
