{
  "$schema": "../../../schema/profile.schema.json",
  "schema_version": 1,
  "name": "classic_verify",
  "description": "All eleven classic stages (A12-A22), including the final verification, until data/profiles/classic.json arrives with A23.",
  "stages": ["c01_allocate", "c02_seed", "c03_fit", "c04_vegetation", "c05_shape", "c06_rivers", "c07_smooth", "c08_climate", "c09_biomes", "c10_subsurface", "c11_verify"]
}
